{
  "schemaVersion": "0.1.0",
  "success": true,
  "backendMode": "native-capture",
  "operation": "daemon_run",
  "daemonState": "running",
  "daemonProcessId": 999996,
  "daemonInstanceId": "fixture-daemon-stale",
  "daemonStartedUtc": "2026-06-10T00:00:00.000Z",
  "daemonHeartbeatUtc": "2026-06-10T00:00:01.000Z",
  "controlEndpoint": "file-registry:tests/fixtures/daemon/valid-stale-registry/runtime",
  "runtimeDirectory": "tests/fixtures/daemon/valid-stale-registry/runtime",
  "sessionCount": 1,
  "win32ErrorCode": 0,
  "message": "Fixture daemon heartbeat."
}
